{
  "formato": "nat78-adjudicacao-respostas-b-1.0.0",
  "lote": "lote-d02-b",
  "loteSha256": "70dad67682cba38758cf8ddd560e7ead847d3a98a3810cbb2aa12a3effa682f8",
  "juiz": "adjudicador-d02",
  "etapa": "b",
  "grupo": "D-d093fa537e",
  "leituraDaNorma": {
    "norma": "citada",
    "fonteEVersao": "Base de regras do DS 3.7.0, texto literal (id mascarado): '5 | Botão Fechar | Componente Button | Opcional.' — linha da anatomia de um componente.",
    "forca": "nenhuma",
    "antecedente": "A linha de anatomia só descreve que o item 5 (botão Fechar) é feito com o componente Button e que esse item é opcional; não há condição que dispare obrigação.",
    "excecoes": "Nenhuma exceção declarada; como o item inteiro é opcional, a regra não proíbe nem obriga forma alguma do botão Fechar.",
    "evidenciaNecessaria": "Para aplicar a regra como obrigação seria preciso um texto que exigisse o elemento <button> nativo; esta regra não o traz (forcaDeclarada 'permitido (opcional)' → forcaNoVocabulario 'nenhuma').",
    "permiteConcluir": "Permite concluir só que o botão Fechar é opcional e, quando presente, descrito como Button; não permite concluir violação. Citada como violada, é erro normativo (R11a), e a sugestão deve ser julgada."
  },
  "leiturasAlternativasPlausiveis": [],
  "classificacaoDaDivergencia": {
    "tipos": [
      "erro-do-juiz"
    ],
    "evidencias": [
      "T3-1ca5723b8e:NORMA",
      "T3-1ca5723b8e:REGRA",
      "T3-1ca5723b8e:S1"
    ],
    "justificativa": "Fato, vínculo (A-06 direta) e medida concordam nas três leituras. A divergência é só a força: a leitura 1 deu forca indeterminado dizendo que \"permitido (opcional)\" não corresponde à lista, mas a NORMA traz forcaNoVocabulario \"nenhuma\" e a tabela fixa do LEIAME-juiz mapeia \"permitido (opcional)\" → nenhuma; com isso aplicabilidade/violada são nao-perguntado e a sugestão passa a ser obrigatória. É erro do juiz, não leitura defensável."
  },
  "respostas": [
    {
      "id": "T3-1ca5723b8e",
      "verdadeFactual": "verdadeira",
      "norma": {
        "id": "citada",
        "forca": "nenhuma",
        "aplicabilidade": "nao-perguntado",
        "violada": "nao-perguntado"
      },
      "vinculo": {
        "spec": "A-06",
        "relacao": "direta"
      },
      "sugestao": {
        "trataOFato": "sim",
        "especificaDoSujeito": "sim",
        "naoViolaNormaObrigatoria": "sim",
        "qualidade": "valida"
      },
      "forcaDoVeredito": "medido",
      "estadoAlcancado": "receita",
      "evidencias": [
        "MEDIDA",
        "OBS",
        "S1",
        "A-06",
        "NORMA",
        "ESP"
      ],
      "justificativa": "MEDIDA (headless 1280x900, após click em button.acao-enviar com formulário vazio) mostra a mensagem .br-message.danger visível com o Fechar S1 = <div class=\"br-button circle small\" role=\"button\" tabindex=\"0\" aria-label=\"Fechar a mensagem\">, como diz OBS; a parte sobre a mensagem de sucesso não aparece neste estado. É o mesmo elemento e fato da A-06; a NORMA citada é só opcional (forca nenhuma), logo não obriga. ESP propõe trocar por <button type=\"button\" class=\"br-button\">, o que corrige o fato neste sujeito sem violar norma obrigatória. Mantido na etapa B: a leitura 1 (forca indeterminado) contraria o forcaNoVocabulario nenhuma da NORMA."
    }
  ]
}
